{
  "assetId": "arm.human.back.crimson_cape.t1.m",
  "displayName": "Crimson Campaign Cape",
  "category": "armor",
  "version": "1.0.0",
  "sets": ["equipment"],
  "runtime": {
    "itemKey": "base_male_crimson_cape",
    "bodyModel": "body_human_armor_fit_t1_m.glb"
  },
  "output": {
    "model": "arm_human_back_crimson_cape_t1_m.glb",
    "artifactDir": "artifacts/blender/manifest/arm_human_back_crimson_cape_t1_m"
  },
  "generator": {
    "kind": "armorModule",
    "preset": "human_blackened_plate",
    "objectNamePrefixes": ["armor_back_cape_heavy_fall"]
  },
  "geometry": {
    "originRule": "same_origin_overlay_root",
    "upAxis": "+Y",
    "forwardAxis": "+Z",
    "bodyFamily": "human_m_tall",
    "skeletonId": "humanoid_v1",
    "bindPoseId": "a_pose_v1",
    "lods": [
      { "name": "LOD0", "triTarget": 2200, "screenCoverageMin": 0.2 },
      { "name": "LOD1", "triTarget": 900, "screenCoverageMin": 0.08 }
    ]
  },
  "attachments": [
    { "name": "AP_ROOT", "type": "root", "parent": "root", "position": [0, 0, 0] },
    { "name": "AP_PELVIS_BACK", "type": "socket", "parent": "pelvis", "position": [0, 0.88, -0.1] }
  ],
  "materials": {
    "master": "MM_Cloth",
    "textureSet": "crimson_cape_t1",
    "channels": ["baseColor", "roughness", "normal", "occlusion"]
  },
  "rigging": { "skinned": false, "maxInfluences": 4, "requiredClips": [] },
  "collision": {
    "policy": "none",
    "primitives": []
  },
  "compatibility": { "occupiesSlots": ["back"], "requires": ["body.human.armor_fit.t1.m"], "conflictsWith": [] },
  "provenance": {
    "createdBy": "procedural_blender_pipeline",
    "aiAssisted": false,
    "aiStages": [],
    "promptIds": [],
    "referencePackId": "neutral_dark_fantasy_v1",
    "similarityReview": "not_required"
  },
  "qc": { "allowNonManifold": false, "allowUvOverlap": true, "maxDrawCalls": 2, "maxFileSizeMb": 2, "groundToleranceM": 0.03 }
}
