{
  "assetId": "chr.enemy.riftbound.riftbound.keep.magister.caster.t1",
  "displayName": "Riftbound Keep Magister",
  "category": "character",
  "version": "1.0.0",
  "sets": [
    "characters",
    "enemy_characters",
    "npc_model_buildout"
  ],
  "runtime": {
    "profileKey": "enemy_riftbound_riftbound_keep_magister_caster"
  },
  "output": {
    "model": "chr_enemy_riftbound_riftbound_keep_magister_caster_t1.glb",
    "artifactDir": "artifacts/blender/manifest/chr_enemy_riftbound_riftbound_keep_magister_caster_t1"
  },
  "generator": {
    "kind": "characterPreset",
    "preset": "enemy_riftbound_riftbound_keep_magister_caster"
  },
  "geometry": {
    "originRule": "armature_root_grounded",
    "upAxis": "+Y",
    "forwardAxis": "+Z",
    "bodyFamily": "enemy_riftbound_riftbound_keep_magister_caster",
    "skeletonId": "humanoid_v1",
    "bindPoseId": "a_pose_v1",
    "lods": [
      {
        "name": "LOD0",
        "triTarget": 70000,
        "screenCoverageMin": 0.2
      },
      {
        "name": "LOD1",
        "triTarget": 42000,
        "screenCoverageMin": 0.1
      },
      {
        "name": "LOD2",
        "triTarget": 18000,
        "screenCoverageMin": 0.04
      }
    ]
  },
  "attachments": [
    {
      "name": "AP_ROOT",
      "type": "root",
      "parent": "root",
      "position": [
        0,
        0,
        0
      ]
    },
    {
      "name": "AP_HAND_WEAPON_R",
      "type": "socket",
      "parent": "hand_r",
      "position": [
        0,
        0,
        0
      ]
    },
    {
      "name": "AP_HAND_SECONDARY_L",
      "type": "socket",
      "parent": "hand_l",
      "position": [
        0,
        0,
        0
      ]
    },
    {
      "name": "AP_BACK",
      "type": "socket",
      "parent": "chest",
      "position": [
        0,
        1.309,
        -0.118
      ]
    }
  ],
  "materials": {
    "master": "MM_CharacterPbr",
    "textureSet": "enemy_riftbound_riftbound_keep_magister_caster_t1",
    "channels": [
      "baseColor",
      "roughness",
      "metallic",
      "normal",
      "occlusion",
      "emissive"
    ]
  },
  "rigging": {
    "skinned": true,
    "maxInfluences": 4,
    "requiredClips": [
      "idle",
      "walk",
      "run",
      "combat_idle",
      "attack_melee",
      "attack_ranged",
      "cast",
      "death",
      "jump"
    ]
  },
  "collision": {
    "policy": "inherits_body_capsule",
    "primitives": [
      {
        "type": "capsule",
        "tag": "character_body"
      }
    ]
  },
  "compatibility": {
    "occupiesSlots": [
      "character"
    ],
    "requires": [],
    "conflictsWith": []
  },
  "provenance": {
    "createdBy": "procedural_blender_pipeline",
    "aiAssisted": true,
    "aiStages": [
      "npc_roster_scan",
      "seeded_feature_variation",
      "procedural_generation"
    ],
    "promptIds": [
      "npc_profile_enemy_riftbound_riftbound_keep_magister_caster"
    ],
    "referencePackId": "neutral_dark_fantasy_npc_v1",
    "similarityReview": "not_required"
  },
  "qc": {
    "allowNonManifold": false,
    "allowUvOverlap": true,
    "maxDrawCalls": 16,
    "maxFileSizeMb": 12,
    "groundToleranceM": 0.03,
    "expectedHeightM": 1.944,
    "maxMeshObjects": 110,
    "requiresSkinnedMeshes": true,
    "requiresPreview": true
  }
}
