{
  "assetId": "prop.frontier.sunmeadow_gatehouse",
  "displayName": "Sunmeadow six-metre passage gatehouse",
  "category": "prop",
  "version": "1.0.0",
  "sets": [
    "sunmeadow_authored_architecture"
  ],
  "runtime": {
    "staticKey": "frontier_sunmeadow_gatehouse"
  },
  "output": {
    "model": "frontier_sunmeadow_gatehouse_lod0.glb",
    "artifactDir": "authoring/blender/sunmeadow-architecture/runtime"
  },
  "generator": {
    "kind": "copyExisting",
    "copyFrom": "authoring/blender/sunmeadow-architecture/runtime/frontier_sunmeadow_gatehouse_lod0.glb"
  },
  "geometry": {
    "originRule": "root_grounded",
    "upAxis": "+Y",
    "forwardAxis": "+Z",
    "lods": [
      {
        "name": "LOD0",
        "triTarget": 239460,
        "screenCoverageMin": 0.2
      },
      {
        "name": "LOD1",
        "triTarget": 81220,
        "screenCoverageMin": 0.08
      },
      {
        "name": "LOD2",
        "triTarget": 34270,
        "screenCoverageMin": 0
      }
    ]
  },
  "materials": {
    "master": "MM_SunmeadowArchitecture",
    "textureSet": "sunmeadow_authored_architecture",
    "channels": [
      "baseColor",
      "roughness",
      "metallic",
      "normal",
      "occlusion"
    ],
    "maxTextureResolution": 1024
  },
  "rigging": {
    "skinned": false,
    "requiredClips": []
  },
  "collision": {
    "policy": "authored_wall_segments",
    "primitives": []
  },
  "compatibility": {
    "occupiesSlots": [
      "prop"
    ],
    "requires": [],
    "conflictsWith": []
  },
  "provenance": {
    "createdBy": "original_authored_mesh_control_cages",
    "aiAssisted": true,
    "aiStages": [
      "art_direction",
      "literal_control_cage_authoring",
      "material_painting",
      "blender_finishing",
      "lod_authoring",
      "technical_validation"
    ],
    "referencePackId": "original_sunmeadow_architecture_v1",
    "similarityReview": "not_required",
    "author": "Codex architecture authoring",
    "source": "authoring/blender/sunmeadow-architecture/source/architecture.json",
    "sourceSha256": "1ec935cb6ad05321db5dd2b87fddb7db2c10c4f41298ed95a3efa5736cb1ec85"
  },
  "qc": {
    "allowNonManifold": true,
    "allowUvOverlap": true,
    "maxTris": 239460,
    "maxFileSizeMb": 17,
    "maxDrawCalls": 10,
    "maxMeshObjects": 1,
    "requiresSkinnedMeshes": false,
    "requiresPreview": true,
    "expectedHeightM": 13.017150644212961,
    "heightToleranceM": 0.03
  },
  "lifecycle": {
    "status": "approved",
    "notes": "Original fitted construction cages remain editable in the Blender master. Closed construction components share tiled material UV space deliberately; UV overlap is required for repeated slate, stone, joinery and hardware. A positional audit welds glTF UV/normal/material seams at 1 micrometre and requires zero boundary edges on all three LODs. The distant wall-walk coping slabs meet exactly at their lower end edges: curtain-wall LOD2 has seven and gatehouse LOD2 has six four-face coincident joints at Z-up 6.12m; the validator permits only those measured joint coordinates. All other assets and LODs require zero multi-face edges. This preserves individually closed fitted pieces without requiring a boolean solid union. Exact measurements and placement contracts are retained in authoring/blender/sunmeadow-architecture/build-report.json. Accepted internally against the exact build and all reimport previews; the approval record retains review hashes.",
    "reviewedBy": "Codex integration reviewer (/root)",
    "reviewedAt": "2026-09-07T17:22:55.0905427Z"
  }
}
